Cluster,Reuse,Length,Group,Blast_text,Node,ID
cluster_237,reuse,92,groupO1,i cui ci lasciava godere serviva a nascondere l abisso che poi morta mia madre ingojò me sol,1003273___15_82,1003273
cluster_239,reuse,34,groupO1,a da quelle labbra neppure un baci,1003274___1_25,1003274
cluster_240,reuse,23,groupO1,attia che sarei io e fu,1003275___1_19,1003275
cluster_241,reuse,38,groupO1,i guardai attorno con una strana costernazione che m,1003276___1_42,1003276
cluster_243,reuse,55,groupO1,i le braccia e trassi un lunghissimo respiro di solliev,1003277___12_55,1003277
cluster_246,reuse,59,groupO1,i si ridestava in quella nera ignota solitudine e mi sentiv,1003278___1_49,1003278
cluster_248,reuse,59,groupB,i sentivo paurosamente sciolto dalla vita superstite di me stess,1003541___1_56,1003541
cluster_248,reuse,59,groupB,i sentivo paurosamente sciolto dalla vita superstite di me stess,1003546___1_56,1003546
cluster_249,reuse,23,groupO1,essuno me ne seppe grat,1003279___1_20,1003279
cluster_250,reuse,115,groupO1,ra mi sarebbe piaciuto che non solo esteriormente ma anche nell intimo non rimanesse più in me alcuna traccia di LU,1003280___1_88,1003280
cluster_251,reuse,115,groupB,on solo esteriormente ma anche nell,1003973___42_72,1003973
cluster_252,reuse,58,groupO1,ra così bella così giovane e fresca moglie di Batta Malagn,1003281___1_40,1003281
cluster_254,reuse,39,groupO1,u un granellino di sabbia impazzito che,1003285___15_45,1003285
cluster_254,reuse,39,groupO1,u un granellino di sabbia impazzito che gir,1003286___60_92,1003286
cluster_257,reuse,104,groupO1,utti lottiamo perchè i nostri sentimenti i nostri pensieri i nostri gusti si riflettano nella cos,1003287___1_80,1003287
cluster_257,reuse,104,groupB,utti lottiamo perchè i nostri sentimenti i nostri pensieri i nostri gusti si riflettano nella cos,1003563___1_80,1003563
cluster_257,reuse,104,groupO2,utti lottiamo perchè i nostri sentimenti i nostri pensieri le nostre inclinazioni i nostri gusti,1003606___1_80,1003606
cluster_258,reuse,45,groupO1,e tranne che nella sera di quello stesso giorn,1003288___19_55,1003288
cluster_262,reuse,26,groupO1,dre in quell atteggiamento,1003290___10_31,1003290
cluster_265,reuse,71,groupO1,i accorsi tutt a un tratto che dovevo proprio morire ancora ecco il mal,1003292___1_54,1003292
cluster_266,reuse,105,groupO1,gni oggetto in noi suol trasformarsi secondo le immagini ch esso evoca e aggruppa per così dire attorno a,1003293___1_78,1003293
cluster_268,reuse,89,groupO1,a coscienza Ma la coscienza non serve caro signore La coscienza come guida non può bastar,1003294___1_64,1003294
cluster_270,reuse,51,groupO1,l cervello sarebbe il pianoforte il sonatore l anim,1003296___1_42,1003296
cluster_270,reuse,51,groupB,l cervello sarebbe il pianoforte il sonatore l anim,1003996___1_42,1003996
cluster_274,reuse,36,groupO1,mo il loro taglio il loro colore pos,1003299___16_44,1003299
cluster_275,reuse,36,groupB,i abiti che indossiamo possono far pensare di noi le più strane cos,1003532___1_53,1003532
cluster_275,reuse,36,groupB,i abiti che indossiamo possono far pensare di noi le più strane cos,1003533___1_53,1003533
cluster_276,reuse,36,groupO2,oi le più strane cos,1003602___24_39,1003602
cluster_277,reuse,32,groupO1,re un nuovo sentimento della vit,1003302___14_42,1003302
cluster_280,reuse,30,groupO1,i posi a far di me un altr uom,1003304___1_24,1003304
cluster_282,reuse,30,groupB,tava a me dovevo esser l artefice del mio nuovo destino nella misura che la,1003422___1_61,1003422
cluster_283,reuse,56,groupO1,i sentivo come rifatta vergine e trasparente la coscienz,1003306___1_46,1003306
cluster_284,reuse,53,groupO1,ell oggetto amiamo quel che vi mettiamo di noi l,1003308___1_37,1003308
cluster_284,reuse,53,groupB,ell oggetto noi amiamo quel che vi mettiamo di noi l,1003391___1_40,1003391
cluster_286,reuse,104,groupO1,o potevo avere solamente relazioni superficiali permettermi un breve scambio di parole alien,1003309___1_78,1003309
cluster_286,reuse,104,groupB,o potevo aver solamente relazioni superficiali permettermi solo co miei simili un breve scambio di parole alien,1003566___1_92,1003566
cluster_287,reuse,108,groupO1,asi potrei credere che mi sia davvero affogato nel mulino della Stia e che intanto mi alluda di vivere ancor,1003310___1_86,1003310
cluster_288,reuse,116,groupO1,o mi ero tolto bene o male il pensiero più fastidioso e più affliggente che si possa avere vivendo quello della mort,1003311___1_90,1003311
cluster_289,reuse,116,groupB,l pensiero più fastidioso e più affliggente che si possa avere vivendo quello della mort,1003362___1_70,1003362
cluster_290,reuse,68,groupO1,opo tante sciocchezze commesse egli non meritava forse sorte miglior,1003312___1_55,1003312
cluster_291,reuse,55,groupO1, chi sa che quel lanternino Basta non voglio dirle altr,1003313___1_42,1003313
cluster_295,reuse,23,groupO1,a Pascal non poteva esse,1003314___5_25,1003314
cluster_297,reuse,58,groupO1,r che cos ero io se non un uomo inventatoUna invenzione ambul,1003315___1_49,1003315
cluster_297,reuse,58,groupB,r che cos ero io se non un homo inventato Adriano Mei,1003553___1_42,1003553
cluster_297,reuse,58,groupB,r che cos ero io se non un uomo inventat,1003559___1_31,1003559
cluster_299,reuse,134,groupO1,a mia fortuna consisteva in questo nell essermi liberato della moglie della suocera dei debiti delle afflizioni umiliant,1003317___1_99,1003317
cluster_302,reuse,27,groupO1,nfidenza e come avrei potut,1003318___17_40,1003318
cluster_305,reuse,47,groupO1,ra questa che nella mia libertà sconfinata mi ri,1003319___15_51,1003319
cluster_308,reuse,47,groupO1,ndo la sua libertà non è così sconfinata M Gr,1003655___4_34,1003655
cluster_309,reuse,19,groupB, nella nostra mente,1003321___38_55,1003321
cluster_310,reuse,81,groupB,driana accanto a me era la vita che aspetta un bacio per schiudersi alla gioi,1003324___1_58,1003324
cluster_311,reuse,65,groupB,o domandato a me stesso se a determinare le nostre azioni non concorrano,1003325___1_60,1003325
cluster_311,reuse,65,groupB,o domandato a me stesso se a determinare le nostre azioni non concorrano,1003333___1_60,1003333
cluster_314,reuse,89,groupB,a libertà fino al capriccio di cui ci lasciava godere serviva a nascondere un abisso di s,1003326___1_64,1003326
cluster_315,reuse,22,groupB,do e infelicissima con,1003327___17_35,1003327
cluster_315,reuse,22,groupB,do e infelicissima con,1003328___17_35,1003328
cluster_315,reuse,22,groupB,do e infelicissima con,1003331___17_35,1003331
cluster_315,reuse,22,groupB,do e infelicissima con,1003332___17_35,1003332
cluster_317,reuse,22,groupB,e anime hanno un loro particolar modo d intendersi d entrare in intimità fino a d,1003447___4_69,1003447
cluster_317,reuse,22,groupB,e anime hanno un loro particolar modo d intendersi d entrare in intimità fino a dars,1003573___1_69,1003573
cluster_317,reuse,22,groupA,e anime hanno un loro particolare modo d intendersi d entrare in inti,1003704___1_58,1003704
cluster_319,reuse,18,groupB,nselmo Paleari Che ce,1003334___45_62,1003334
cluster_319,reuse,18,groupB,nselmo Paleari=p,1003584___1_16,1003584
cluster_321,reuse,16,groupB,ano nella propri,1003336___19_34,1003336
cluster_326,reuse,33,groupB,utti a innamorarvi del numer,1003339___7_32,1003339
cluster_326,reuse,33,groupB,ndate a innamorarvi del numero 12 Infat,1003922___1_33,1003922
cluster_326,reuse,33,groupB,ndate a innamorarvi del numero 12 Infa,1003923___1_32,1003923
cluster_328,reuse,57,groupB,sogna ingegnarsi in tutti i modi tentar comunque di veder,1003341___1_45,1003341
cluster_332,reuse,47,groupB, Adriano è per la tirannia mascherata da liber,1003347___4_40,1003347
cluster_332,reuse,47,groupA, appunto per questa tirannia mascherata da libert,1003706___8_48,1003706
cluster_333,reuse,47,groupB,attia pascal nell,1003457___10_25,1003457
cluster_333,reuse,47,groupB,attia pascal,1003465___21_32,1003465
cluster_337,reuse,21,groupB,ortunatamente Mattia non è s,1003355___1_25,1003355
cluster_339,reuse,34,groupB, quelle acque bussarmi alla finestr,1003356___60_87,1003356
cluster_342,reuse,16,groupB,ontecarlo non è p,1003359___14_27,1003359
cluster_343,reuse,69,groupB,el tanfo speciale delle cose antiche quasi il respiro d un altro temp,1003360___23_77,1003360
cluster_344,reuse,69,groupB,asi il respiro di un altro te,1003499___1_25,1003499
cluster_345,reuse,58,groupB,l male della scienza guardi signor Meis è tutto qui che vuole occupa,1003361___1_50,1003361
cluster_346,reuse,38,groupB,apporto Mattia Vedova Pescatore è un t,1003363___3_34,1003363
cluster_346,reuse,38,groupB,ddio di Mattia alla suocera vedovaPescator,1003951___2_38,1003951
cluster_347,reuse,38,groupB,edova Pescatore credeva davvero di poter averla vinta contro zia Scol,1003902___7_63,1003902
cluster_349,reuse,38,groupB,o butto giù come vien viene Coraggio dunqu,1003366___1_29,1003366
cluster_349,reuse,38,groupO1,o butto giù come vien viene Coraggio dunqu,1003630___1_29,1003630
cluster_349,reuse,38,groupO1,o butto giù come vien viene coraggio dunque a,1003765___1_31,1003765
cluster_351,reuse,34,groupB,el pover uomo al punto di sposa,1003367___47_73,1003367
cluster_352,reuse,91,groupB,a barchetta della mia finzione potè alla fine filare al largo e issar la vela della fantasi,1003368___1_73,1003368
cluster_355,reuse,57,groupB,a vista del mare mi faceva cadere in uno sgomento attonit,1003373___1_46,1003373
cluster_357,reuse,17,groupB, aria di campagna,1003377___1_14,1003377
cluster_358,reuse,18,groupB, prima di tutto si,1003378___49_64,1003378
cluster_360,reuse,40,groupB, erede di una serie di generazioni,1003379___1_29,1003379
cluster_361,reuse,23,groupB, foga irresistibile non f,1003380___21_41,1003380
cluster_368,reuse,21,groupB, miserie incalcolabil,1003393___36_53,1003393
cluster_370,reuse,54,groupB,andi città  come Roma da un acquasantiera a un portacene,1003394___33_74,1003394
cluster_370,reuse,54,groupB,andi città come Roma da un acquasantiera a un portacene,1003395___33_74,1003395
cluster_372,reuse,30,groupB, Le jeu est fait Rien ne va plu,1003396___27_51,1003396
cluster_374,reuse,29,groupB,er un momento ho pensato di sta,1003399___1_27,1003399
cluster_376,reuse,38,groupB,e che non possono essere pronunciat,1003400___21_50,1003400
cluster_380,reuse,19,groupB,ttia lanterninosofi,1003408___68_87,1003408
cluster_381,reuse,69,groupB, Provi ad accendervi una la lampadina da oggi con l olio puro dell anim,1003412___15_68,1003412
cluster_383,reuse,46,groupB,a vita è un tristo privilegio dell uomo se egl,1003415___8_43,1003415
cluster_383,reuse,46,groupB,a vita è un tristo privilegio dell uomo se egl,1003416___8_43,1003416
cluster_385,reuse,16,groupB,a Scolastica doce,1003429___2_15,1003429
cluster_390,reuse,33,groupB,utto e tutti non è necessariament,1003434___10_37,1003434
cluster_390,reuse,33,groupB,utto e tutti non è necessariament,1003435___10_37,1003435
cluster_396,reuse,38,groupB,i mise a malmenarla senza alcun ritegn,1003443___4_35,1003443
cluster_397,reuse,51,groupB,ffascinavo la fortuna legavo al mio il suo capricci,1003446___4_43,1003446
cluster_405,reuse,22,groupB, poi altro mi trattien,1003458___43_62,1003458
cluster_405,reuse,22,groupB, poi altro mi trattien,1003459___43_62,1003459
cluster_406,reuse,97,groupB, momento concepii cosi misera stima dei libri che non mi sarei mai e poi mai messo a scrivere s,1003461___11_82,1003461
cluster_407,reuse,97,groupO1,n dal primo giorno io concepii così misera stima dei libri che ora non mi sarei mai e poi mai messo a scriver,1003641___3_83,1003641
cluster_409,reuse,26,groupB,arla del nome Mattia Pascal,1003463___21_44,1003463
cluster_413,reuse,26,groupO1,à Mattia Pascal R,1003668___28_41,1003668
cluster_413,reuse,26,groupB,AB96 Mattia Pascal,1003801___1_14,1003801
cluster_415,reuse,43,groupB,orse la stupidità degli uomini che non sono stati,1003469___1_40,1003469
cluster_415,reuse,43,groupB,orse la stupidità degli uomini che non sono stati mai così noios,1003482___34_83,1003482
cluster_415,reuse,43,groupO1,orse la stupidità degli uomin,1003691___44_68,1003691
cluster_415,reuse,43,groupO1,orse la stupidità degli uomin,1003747___44_68,1003747
cluster_417,reuse,14,groupB,uori dalla vit,1003474___59_72,1003474
cluster_417,reuse,14,groupA,uori dalla vit,1003777___26_39,1003777
cluster_419,reuse,66,groupB,pernico Copernico don Eligio mio ha rovinato l umanità  irrimediabi,1003477___1_53,1003477
cluster_419,reuse,66,groupB,pernico Copernico don Eligio mio ha rovinato l umanità irrimediabi,1003478___1_53,1003478
cluster_421,reuse,33,groupB,a è solo una scusa per gli ubriach,1003479___31_54,1003479
cluster_425,reuse,26,groupB,anno anche questo e il nom,1003485___1_21,1003485
cluster_425,reuse,26,groupB,anno anche questo e il nom,1003486___1_21,1003486
cluster_426,reuse,44,groupB,me già fuori dalla vita e dunque senza obbligh,1003487___17_50,1003487
cluster_428,reuse,15,groupB,tellona bisbeti,1003498___13_26,1003498
cluster_431,reuse,44,groupB, afferro per il mento dicendomi Muso di can,1003503___1_35,1003503
cluster_431,reuse,44,groupB, afferro per il mento dicendomi Muso di can,1003504___1_35,1003504
cluster_432,reuse,120,groupB, afferrò per il mento lo strinse forte dicendomi Bellino Bellino Poi mi lasciò ruggendo tra i denti muso di can,1003505___1_84,1003505
cluster_433,reuse,120,groupO2, strinsi forte forte la mano di Adriana fino a fa,1003626___2_42,1003626
cluster_438,reuse,80,groupB,assare anche per imbecille o per peggio non sarebbe in fondo per me un gran guaj,1003509___1_58,1003509
cluster_439,reuse,80,groupB,ino era come la nostra ombra e cangiava con meravigliosa facoltà scimmies,1003511___1_55,1003511
cluster_439,reuse,80,groupB,ino era come la nostra ombra e cangiava con meravigliosa facoltà scimmies,1003512___1_55,1003512
cluster_440,reuse,121,groupB,ra uno spasso sentirgli fare una predica alla moglie sulla continenza mentre lui divorava i cibi più succulent,1003513___1_86,1003513
cluster_440,reuse,121,groupB,ra uno spasso sentirgli fare una predica alla moglie sulla continenza mentre lui divorava i cibi più succulent,1003516___1_86,1003516
cluster_440,reuse,121,groupB,ra uno spasso sentirgli fare una predica alla moglie su la continenza mentre lui divorava i cibi più succulent,1003522___1_85,1003522
cluster_441,reuse,69,groupB,n questo momento una tua lettera potrebbe essere per lei assediata da quel ragno un ancora di salvezz,1003514___1_80,1003514
cluster_441,reuse,69,groupB,n questo momento una tua lettera potrebbe essere per lei assediata da quel ragno un ancora di salvezz,1003517___1_80,1003517
cluster_442,reuse,81,groupB,i fermai impressionato innanzi a un pagliaio nano e panciuto ti conosco Gli dicevo Poi,1003515___1_68,1003515
cluster_442,reuse,81,groupB,i fermai impressionato innanzi a un pagliaio nano e panciuto ti conosco Gli dicevo Poi,1003518___1_68,1003518
cluster_445,reuse,87,groupB,nche i ladri m immagino debbono avere una certa impostatura ch egli mi pareva non avess,1003521___1_67,1003521
cluster_448,reuse,89,groupB,ra come con una faccia e un corpo così fatti Malagna potesse esser tanto ladro io non s,1003523___1_64,1003523
cluster_449,reuse,56,groupB,erchè mostravo tanta smania di maritar Romilda Per nient,1003524___1_48,1003524
cluster_452,reuse,15,groupB,ntemporaneament,1003528___12_28,1003528
cluster_453,reuse,34,groupB, non dava fastidio neanche all ari,1003529___1_29,1003529
cluster_453,reuse,34,groupB, non dava fastidio neanche all ari,1003530___1_29,1003530
cluster_455,reuse,57,groupB, poco a poco guardando la febbre del giuoco prese anche m,1003531___1_40,1003531
cluster_456,reuse,35,groupB,n nessuno Mi annoio mortalment,1003534___1_28,1003534
cluster_457,reuse,14,groupB, Montecarlo pe,1003536___10_22,1003536
cluster_460,reuse,39,groupB, poco la febbre del giuoco prese anche m,1003540___15_42,1003540
cluster_461,reuse,22,groupB,ibero libero libero Che ce,1003542___1_19,1003542
cluster_461,reuse,22,groupB,ibero Libero Liber,1003548___50_64,1003548
cluster_461,reuse,22,groupB,ibero libero liber,1003933___1_15,1003933
cluster_463,reuse,44,groupB,aziosa pallottola d avorio nostra dea crudel,1003543___32_70,1003543
cluster_463,reuse,44,groupB,aziosa pallottola d avorio nostra dea crudel,1003544___32_70,1003544
cluster_463,reuse,44,groupB,aziosa pallottola d avorio nostra dea crudel,1003932___1_39,1003932
cluster_464,reuse,36,groupB,sì pensavo e il treno intanto correv,1003545___1_30,1003545
cluster_465,reuse,16,groupB,er la prima volt,1003547___14_28,1003547
cluster_468,reuse,108,groupB,sservando la vita degli altri ne vedevo gli infiniti legami e al tempo stesso vedevo le tante mie fila spezzat,1003549___1_90,1003549
cluster_470,reuse,80,groupB,prii gli occhi e rimasi un pezzo accigliato a contemplarlo nella palma della man,1003550___1_62,1003550
cluster_471,reuse,21,groupB,adrone di me Senza do,1003551___13_31,1003551
cluster_478,reuse,21,groupB,to Adriano Meis Tu hai,1003577___23_42,1003577
cluster_478,reuse,21,groupB,to Adriano Mei,1003578___23_36,1003578
cluster_479,reuse,35,groupB,on volli immaginarmi una nuova mamm,1003555___1_31,1003555
cluster_482,reuse,118,groupB,ella coscienza secondo me esiste una relazione essenziale tra me che penso e gli altri esseri che io pens,1003562___1_83,1003562
cluster_483,reuse,77,groupB,a scienza pensavo ha l illusione di render più facile e più comoda l esistenz,1003564___1_60,1003564
cluster_484,reuse,34,groupB,nsomma io dovevo vivere vivere viver,1003565___1_33,1003565
cluster_486,reuse,96,groupB,ì ma ecco per dir la verità  temevo che della mia compagnia non mi sarei tenuto nè contento nè pa,1003568___1_69,1003568
cluster_486,reuse,96,groupB,ì ma ecco per dir la verità temevo che della mia compagnia non mi sarei tenuto nè contento nè pa,1003569___1_69,1003569
cluster_488,reuse,96,groupB,attia non mi sare,1003873___13_28,1003873
cluster_490,reuse,61,groupB,me se l umanità non fossi io non fosse lei e a uno a uno tutt,1003570___1_47,1003570
cluster_491,reuse,101,groupB, papi ne avevano fatto un acquasantiera noi italiani ne abbiamo fatto un portacener,1003571___1_67,1003571
cluster_494,reuse,98,groupB,a la causa vera di tutti i nostri mali di questa tristezza nostra sai qual è La democrazia mio car,1003574___1_75,1003574
cluster_495,reuse,22,groupB, se ne andò ciabattand,1003576___1_17,1003576
cluster_497,reuse,22,groupB,iù morto Adriano Meis di Mattia,1003808___8_34,1003808
cluster_499,reuse,34,groupB,i abbandonai senza più riflettere a,1003581___12_40,1003581
cluster_504,reuse,20,groupB,on come sol risplend,1003582___16_33,1003582
cluster_508,reuse,28,groupB,o ero tentato di rispondergl,1003583___15_39,1003583
cluster_513,reuse,102,groupB,i svolse dico una sua concezione filosofica speciosissima che si potrebbe forse chiamare laterninosofi,1003585___2_83,1003585
cluster_514,reuse,55,groupB,ue colpi sì tre colpi no quattro bujo cinque sei lu,1003586___1_36,1003586
cluster_516,reuse,88,groupB,otei sperimentare che l uomo quando soffre si fa una particolare idea del bene e del mal,1003587___1_70,1003587
cluster_520,reuse,34,groupB,inerva Chi è Minerva La mia cagnett,1003591___15_41,1003591
cluster_521,reuse,114,groupB,enevo a quella manina un lungo discorso intenso stridente e pur carezzevole che ascoltava tremante e abbandonat,1003592___1_89,1003592
cluster_525,reuse,96,groupB,veva una testa ma per pensare e comprendere ch erala testa di un ombra e non l ombra di una test,1003595___1_74,1003595
cluster_526,reuse,93,groupB, che la vita che m ero veduta dinanzi libera libera libera non fosse in fondo che un illusion,1003596___1_71,1003596
cluster_529,reuse,103,groupB,o non dovevo uccidere me un morto io dovevo uccidere quella folle assurda finzione che mi aveva torturat,1003598___1_83,1003598
cluster_530,reuse,50,groupB,calzo con le scarpe in mano pallidissimo senza gia,1003600___1_40,1003600
cluster_532,reuse,65,groupB,i avevano ucciso davvero Ed esse esse solo si erano liberate di m,1003601___1_52,1003601
cluster_534,reuse,29,groupO2,gnota solitudine mi senti,1003604___12_34,1003604
cluster_534,reuse,29,groupA, giacchè la solitudine riusciva ormai i,1003782___1_30,1003782
cluster_536,reuse,20,groupO2, infanzia di Adriano,1003605___1_19,1003605
cluster_537,reuse,70,groupO2, la perplessità angosciosa nè ritegni nè intoppi nè ombre nè pietà null,1003608___3_53,1003608
cluster_538,reuse,95,groupO2,ra piangeva per un bisogno irrefrenabile di dare uno sfogo all animo così tremendamente percors,1003611___1_75,1003611
cluster_538,reuse,95,groupO2,ra piangeva per un bisogno irrefrenabile di dare uno sfogo all animo così tremendamente percors,1003612___1_75,1003612
cluster_540,reuse,61,groupO2,entii soffocarmi dalla nausea dall ira dall odio per me stess,1003613___1_52,1003613
cluster_542,reuse,94,groupO2,sì domande supposizioni pensieri sentimenti tumultuavano in me mentre il treno rombava la not,1003614___1_80,1003614
cluster_543,reuse,73,groupO2,e assurdità della vita non hanno bisogno di parer verosimili perchè sono ver,1003618___11_71,1003618
cluster_545,reuse,119,groupO2, con uno sguardo dolce e mesto a un tempo di quegli occhi che mi fecero fin dal primo vederla una così forte impression,1003621___1_87,1003621
cluster_547,reuse,56,groupO2,oi abbiamo sempre vissuto e sempre vivremo con l univers,1003623___1_46,1003623
cluster_548,reuse,96,groupO2,no alla bocca poi mi chinai a cercar la bocca di lei e così il primo bacio fu scambiat,1003624___11_65,1003624
cluster_548,reuse,96,groupO2,no alla bocca poi mi chinai a cercar la bocca di lei e così il primo bacio fu scambiat,1003625___11_65,1003625
cluster_552,reuse,15,groupO2,e tremava la vo,1003627___1_14,1003627
cluster_553,reuse,34,groupO1,on c era altra via di scampo per m,1003629___1_26,1003629
cluster_554,reuse,118,groupO1, mi tenne la mano fin sulla soglia dell uscio come se temesse ancora che lasciandomi io potessi sparire di nuov,1003633___1_87,1003633
cluster_556,reuse,53,groupO1,o Quando venne a sapere della tassa da pagare definisce,1003637___28_72,1003637
cluster_558,reuse,18,groupO1, suo matrimoni,1003643___24_37,1003643
cluster_560,reuse,76,groupO1,ui per circa due anni non so se più cacciatore di topi che guardiano di libr,1003646___1_54,1003646
cluster_568,reuse,16,groupO1,isce Adriano Mei,1003665___12_26,1003665
cluster_572,reuse,59,groupO1,a storia doveva esser fatta per raccontare e non per provar,1003669___1_49,1003669
cluster_575,reuse,29,groupO1,i scrivere mi è venuto dal mi,1003672___6_28,1003672
cluster_576,reuse,31,groupO1,o amico don Eligio Pellegrinott,1003673___28_53,1003673
cluster_581,reuse,16,groupO1,one necessaria p,1003674___21_35,1003674
cluster_583,reuse,29,groupO1,er tanti anche adesso non gir,1003675___40_63,1003675
cluster_584,reuse,24,groupO1, il suo nome Mattia Pasca,1003684___23_43,1003684
cluster_585,reuse,108,groupO1,er quanti sforzi facciamo nel crudele intento di strappare di distruggere le illusioni non ci riusciamo Laur,1003689___1_86,1003689
cluster_587,reuse,48,groupO1,a mia madre a sentirla parlare pareva una bambin,1003693___9_48,1003693
cluster_589,reuse,98,groupO1,on mi sarei mai e poi mai messo a scrivere se come ho detto non stimassi davvero strano il mio cas,1003698___1_77,1003698
cluster_591,reuse,63,groupA,onna brutta e vecchia Tre disgrazie a cui non c è rimedio Ch,1003700___1_42,1003700
cluster_592,reuse,79,groupA, bianco campanile tu potevipendere da una parte io tra quei due nè di qua nè di,1003701___1_58,1003701
cluster_593,reuse,64,groupA,ndo mi nasceva a mano a mano il rimpianto d un bene che non avev,1003705___5_53,1003705
cluster_594,reuse,64,groupB,o soffro per questa tirannia mascherata da libertà  Torniamo a casaIl fantoccio che si è cr,1003994___1_67,1003994
cluster_594,reuse,64,groupB,o soffro per questa tirannia mascherata da libertà Torniamo a casaIl fantoccio che si è cr,1003995___1_67,1003995
cluster_596,reuse,18,groupA, guardare il fium,1003708___22_36,1003708
cluster_599,reuse,116,groupA,utta la differenza signor Meis fra la tragedia antica e la moderna consiste in ciò in un buco nel cielo di cart,1003710___1_82,1003710
cluster_601,reuse,37,groupA,n me ne andavo non potevo più andarme,1003711___2_32,1003711
cluster_604,reuse,70,groupA,are il MORTO non è una bella professione ed eccomi qua mi rifaccio VIV,1003717___9_60,1003717
cluster_605,reuse,34,groupA,on sono mai stato più vivo d adess,1003719___1_28,1003719
cluster_607,reuse,43,groupA,i permetti forte le mani sul volto sentendomi stringere il cuore d angosci,1003721___1_60,1003721
cluster_609,reuse,37,groupA, non dover più mentire non dover tem,1003723___45_74,1003723
cluster_610,reuse,95,groupA,i trovai ancora una volta sperduto pur qui nel mio paesello nativo solo senza casa senza me,1003724___1_74,1003724
cluster_612,reuse,95,groupB,i ancora una volta f,1003924___22_38,1003924
cluster_613,reuse,71,groupA,rrivai alla stazione in tempo per il treno delle dodici e dieci per Pis,1003725___1_58,1003725
cluster_614,reuse,78,groupA,mpresi così che non ostante quel mio strambo aspetto ella avrebbe potuto amarm,1003726___1_61,1003726
cluster_616,reuse,76,groupA, mi rivedevo nei primi giorni beato nell incoscienza o piuttosto nella folli,1003727___1_62,1003727
cluster_617,reuse,108,groupA, restavo lì perplesso smanioso nella mal contentezza di me anzi in orgasmo continuo eppur sorridente di fuor,1003728___1_89,1003728
cluster_618,reuse,38,groupA,gno e morto a Roma Non sapendo che far,1003731___10_39,1003731
cluster_621,reuse,90,groupA,i pareva che ogni sua parola ogni sua domanda fosse pur la più ovvia nascondesse un insidi,1003732___1_71,1003732
cluster_634,reuse,46,groupO1,battere le illusioni create dalla provvida natur,1003755___13_54,1003755
