Cluster,Reuse,Length,Group,Blast_text,Node,ID
cluster_407,reuse,63,groupB,n giorno o l altro io dovevo pur morire sul serio non mi dispia,1010395___1_51,1010395
cluster_408,reuse,91,groupB,el mio stesso corpo cè l unghia il dente il pelo e cè perbacco il finissimo tessuto ocular,1010396___1_65,1010396
cluster_409,reuse,86,groupB,a perchè non possiamo comprendere la vita se in qualche modo non ci spieghiamo la mort,1010398___1_66,1010398
cluster_410,reuse,92,groupB,duto in una faccia volgarmente brutta un pajo d occhi più dolenti di quelli della signorina Caporal,1010399___10_84,1010399
cluster_414,reuse,92,groupA,a ragione la signorina Caporale lo specchio lo specchio aveva par,1010706___14_63,1010706
cluster_414,reuse,92,groupO2,ella minuscola mammina e Silvia Caporale arrabbiata d amore quanti modi d esser don,1010785___15_81,1010785
cluster_414,reuse,92,groupO1,ta per il signor Anselmo era appunto come u,1010839___23_57,1010839
cluster_415,reuse,93,groupB,llora passata l angoscia le due anime sollevate si ricercano e tornano a sorridersi da lontan,1010401___1_76,1010401
cluster_417,reuse,16,groupB,re d una finestr,1010402___25_39,1010402
cluster_417,reuse,16,groupB,re d una finestr,1010403___25_39,1010403
cluster_418,reuse,37,groupB,ifficile per me mantenere il segret,1010404___53_82,1010404
cluster_418,reuse,37,groupB, difficoltà nel nascondere il segreto,1010443___8_37,1010443
cluster_419,reuse,109,groupB,ovetti riconoscere che per quanto neanche io vi avessi fatto mai attenzione poteva darsi che avessi quel vezz,1010405___1_87,1010405
cluster_420,reuse,64,groupB,n pensiero un immagine dovette balenarle in quel punto alla ment,1010406___1_53,1010406
cluster_420,reuse,64,groupB,n pensiero un immagine dovette balenarle in quel punto alla ment,1010437___1_53,1010437
cluster_420,reuse,64,groupO1,n pensiero un immagine dovette balenarle in quel punto alla ment,1010849___1_53,1010849
cluster_421,reuse,109,groupB,an mano che la familiarità cresceva per la considerazione e la benevolenza che mi dimostrava il padrone di cas,1010407___1_86,1010407
cluster_422,reuse,93,groupB, il mio spirito ridiventò ilare come nella prima giovinezza perdette il veleno dell esperienz,1010408___1_78,1010408
cluster_424,reuse,27,groupB,a dolce fanciulla in quella sua cura gen,1010410___15_44,1010410
cluster_424,reuse,27,groupB,a dolce fanciull,1010438___30_43,1010438
cluster_428,reuse,71,groupB,nerosa dell uomo ed ha una buona di coraggio per amar veramente un uom,1010413___10_64,1010413
cluster_429,reuse,71,groupA,a donna è più generosa dell uomo non,1010733___5_32,1010733
cluster_430,reuse,71,groupA, è più generosa dell uomo e non ba,1010645___19_42,1010645
cluster_432,reuse,36,groupB,a tragedia di Oreste in un teatrino di marionett,1010415___1_41,1010415
cluster_432,reuse,36,groupB,a tragedia di Oreste in un teatrino di marionett,1010462___1_41,1010462
cluster_437,reuse,61,groupB,mpresi che non ostante quel mio strambo aspetto ella avre,1010421___1_47,1010421
cluster_437,reuse,61,groupA,mpresi così che non ostante quel mio strambo aspetto ella avrebbe potuto amarm,1010712___1_61,1010712
cluster_440,reuse,59,groupB,ando molti governano pensano soltanto a contentar se stess,1010422___1_50,1010422
cluster_440,reuse,59,groupO1,ando i molti governano pensano soltanto a contentar se stess,1010847___1_51,1010847
cluster_440,reuse,59,groupO1,ando i molti governano pensano soltanto a contentar se stess,1010848___1_51,1010848
cluster_443,reuse,111,groupB,n desiderio vago come un aura dell anima aveva schiuso pian piano per lei come per me una finestra nell avvenir,1010429___1_89,1010429
cluster_443,reuse,111,groupA,n desiderio vago come un aura dell anima aveva schiuso pian piano per lei come per me una finestra nell avvenir,1010907___1_89,1010907
cluster_444,reuse,21,groupB,n fondo a un bicchier,1010430___26_41,1010430
cluster_445,reuse,27,groupB,nfesso che provai gusto che quella conver,1010431___1_32,1010431
cluster_445,reuse,27,groupO1,nfesso che pro,1010582___5_17,1010582
cluster_446,reuse,108,groupB,o qui rappresento la disgrazia della sua vita la follia di suo padre rappresentò forse un umiliazione per le,1010433___1_89,1010433
cluster_457,reuse,100,groupB,asi fino all alba mi rivoltai sul letto fantasticando di quell infelice sepolto nel cimitero di Mira,1010444___1_81,1010444
cluster_460,reuse,75,groupB,el mio povero e timidissimo francese volli fargli notare che aveva sbagliat,1010445___1_61,1010445
cluster_461,reuse,33,groupB,a vita per lui è quasi un gioco d a,1010446___1_24,1010446
cluster_461,reuse,33,groupB,a vita per lui è quasi un gioco d a,1010463___1_24,1010463
cluster_461,reuse,33,groupO2,a vita per lui è tutta un gi,1010671___1_21,1010671
cluster_462,reuse,18,groupB,a io non potevo fa,1010447___16_31,1010447
cluster_465,reuse,17,groupB,iei sentimenti pe,1010448___11_27,1010448
cluster_470,reuse,81,groupB,ra in grado di sapere meglio di me come si chiamasse quel suo zio andato in ameri,1010449___1_62,1010449
cluster_471,reuse,21,groupB,roveniva anche da due,1010450___15_33,1010450
cluster_473,reuse,79,groupB,i trovai davanti allo specchio come se qualcuno mi ci avesse condotto per m,1010451___1_57,1010451
cluster_473,reuse,79,groupB,i trovai senza saperlo davanti allo specchio come se qualcuno mi ci avesse condotto per man,1010457___1_71,1010457
cluster_473,reuse,79,groupB,i trovai davanti allo specchio come se qualcuno mi ci avesse condotto per m,1010458___1_57,1010458
cluster_475,reuse,106,groupB, irritazione ch egli mi cagionava con quel suo tratto da vessatore servizievole m impediva di dissimularla ben,1010452___1_88,1010452
cluster_475,reuse,106,groupB, irritazione ch egli mi cagionava con quel suo tratto da vessatore servizievole m impediva di dissimularla ben,1010475___1_88,1010475
cluster_475,reuse,106,groupB, irritazione ch egli con quel suo tratto da vessatore servizievole m impediva di dissimularla ben,1010546___6_84,1010546
cluster_476,reuse,40,groupB,enza aver commesso cattive azioni senza aver fatto,1010453___1_43,1010453
cluster_476,reuse,40,groupB,enza aver commesso cattive a,1010455___1_24,1010455
cluster_478,reuse,21,groupB,cciarsi in ogni intri,1010454___10_26,1010454
cluster_485,reuse,61,groupB,onna brutta e vecchia esclamò tre disgrazie a cui non c è rimedi,1010461___1_45,1010461
cluster_485,reuse,61,groupA,onna brutta e vecchia tre disgrazie a cui non c è rimedi,1010919___1_40,1010919
cluster_487,reuse,14,groupB,OLTANTO ASPETT,1010466___20_34,1010466
cluster_488,reuse,47,groupB,a cattiva impressione che Papiano aveva avuto su Adriano Meis si foss,1010467___1_58,1010467
cluster_492,reuse,109,groupB,erdetti da quella sera in poi il dominio di me stesso cominciai a sforzare apertamente la timidezza di Adrian,1010468___1_90,1010468
cluster_494,reuse,23,groupB,eanche la morte mi vuol,1010469___1_20,1010469
cluster_495,reuse,67,groupB,a ragione il nesso l opportunità di essi rimanevano lassù tra le nuvol,1010470___1_57,1010470
cluster_495,reuse,67,groupB,a ragione il nesso l opportunità di essi rimanevano lassù tra le nuvol,1010474___1_57,1010474
cluster_495,reuse,67,groupA,a ragione l opportunità di essi rimanevano lassù tra le nuvol,1010926___1_50,1010926
cluster_496,reuse,20,groupB,n tetto sproporzionat,1010472___22_42,1010472
cluster_498,reuse,60,groupB,o lasciai là in quell atteggiamento per contemplarlo un pezz,1010476___1_47,1010476
cluster_498,reuse,60,groupB,o lasciai lì in quell atteggiamento per contemplarlo un pezz,1010477___1_47,1010477
cluster_499,reuse,60,groupO1,ate le marionette sospirai su le cui teste di legno il finto,1010836___1_49,1010836
cluster_499,reuse,60,groupO1,ate le marionette sospirai su le cui teste di legno il finto cielo s,1010837___1_54,1010837
cluster_499,reuse,60,groupA,ate le marionette Non perplessità angosciose nè rit,1010912___1_42,1010912
cluster_499,reuse,60,groupA,ate le marionette Non perplessità angosciose nè rit,1010913___1_42,1010913
cluster_500,reuse,113,groupB,ddentò il fazzolettino che teneva in mano per impedirsi di piangere lo strappò a più riprese rabbiosament,1010479___1_84,1010479
cluster_503,reuse,57,groupB, un tratto la vista mi s annebbiò sembrandomi di scorgere nel rigo seguent,1010483___2_56,1010483
cluster_504,reuse,90,groupB,A VITA NOSTRA RIMANE COME IMPRIGIONATA COME ESCLUSA PER ALCUN TEMPO DALLA VITA UNIVERSAL,1010485___1_72,1010485
cluster_504,reuse,90,groupA,a vita nostra rimane come imprigionata come esclusa per alcun tempo della vita universale et,1010938___1_75,1010938
cluster_505,reuse,40,groupB,apevo sì di trovarmi in una casa estrane,1010486___1_33,1010486
cluster_507,reuse,20,groupB,nni e delle nostre s,1010487___44_61,1010487
cluster_507,reuse,20,groupB,nni e delle nostre s,1010496___44_61,1010496
cluster_507,reuse,20,groupB,ndoci delle nostre s,1010525___65_82,1010525
cluster_507,reuse,20,groupB,ndoci delle nostre s,1010528___65_82,1010528
cluster_511,reuse,26,groupB, fa vedereil male eil ben,1010488___71_91,1010488
cluster_515,reuse,19,groupB, privilegio di vive,1010490___15_31,1010490
cluster_516,reuse,88,groupB,a religione di fronte a questo problema drizza orecchie d asino e adombra come la scienz,1010491___1_67,1010491
cluster_519,reuse,40,groupB,umicino piagnucoloso ci fa vedere solo un,1010493___4_36,1010493
cluster_520,reuse,30,groupB, io ero tentato di rispondergl,1010494___15_40,1010494
cluster_523,reuse,69,groupB,nganniamo così facilmente Massime quando ci piaccia di credere in qua,1010495___1_51,1010495
cluster_529,reuse,101,groupB,e la morte che ci fa tanta paura non esistesse e fosse soltanto il soffio che spegne in noi questo,1010502___1_76,1010502
cluster_531,reuse,101,groupB,e gli altri non gli fanno il bene per dovere egli accusa di tutto il male che,1010506___1_56,1010506
cluster_531,reuse,101,groupA, se gli altri non gli fanno il bene quasi per dovere egli li accus,1010717___1_47,1010717
cluster_531,reuse,101,groupA,e gli altri non gli fanno il bene egli li accusa e di tutto il male chegli fa qua,1010940___1_56,1010940
cluster_531,reuse,101,groupA,e gli altri non gli fanno il bene egli li accusa e di tutto il male ch egli fa qua,1010941___1_56,1010941
cluster_534,reuse,66,groupB,veva parole di fuoco lui Papino per bollare questo indegno ricatto del P,1010510___1_57,1010510
cluster_534,reuse,66,groupO2,veva parole di fuoco per bollare questo indegno ricatt,1010900___1_43,1010900
cluster_535,reuse,25,groupB,tarà su me sepolto viva nè pi,1010512___1_23,1010512
cluster_535,reuse,25,groupB,tarà su me sepolto vivo nè pi,1010513___1_23,1010513
cluster_538,reuse,48,groupB,i veniva da sorridere così di tutto e ad ogni cos,1010515___1_37,1010515
cluster_539,reuse,24,groupB,er il momento soffocato,1010516___17_37,1010516
cluster_541,reuse,58,groupB,orale aveva ricevuto un pugno sulla bocca formidabile Ahah,1010517___12_57,1010517
cluster_541,reuse,58,groupB,orale aveva ricevuto un pugno sulla bocca formidabile Ahah,1010518___12_57,1010518
cluster_541,reuse,58,groupB,orale aveva ricevuto un pugno sulla bocca formidabile Ahah,1010527___12_57,1010527
cluster_543,reuse,101,groupB,i di Adriana Gliela strinsi gradatamente come per infonderli calore e fiduci,1010519___14_75,1010519
cluster_545,reuse,62,groupB,à l avevo costretta a cedermi le dita a intrecciarlo con le mi,1010521___1_46,1010521
cluster_546,reuse,80,groupB,n ardente ebrezza mi aveva preso che godeva allo spasimo che le costava lo sforz,1010522___1_63,1010522
cluster_546,reuse,80,groupB,n ardente ebrezza mi aveva preso che godeva allo spasimo che le costava lo sforz,1010523___1_63,1010523
cluster_548,reuse,80,groupA,icordo di qualche cosa fatta durante il giorn,1010953___59_93,1010953
cluster_553,reuse,57,groupB,a notte in questo caso non dimostra veramente d aver cuor,1010530___1_46,1010530
cluster_554,reuse,31,groupB,vegliandomi nel cuore della nott,1010531___1_28,1010531
cluster_556,reuse,18,groupB,la vita degli altr,1010534___31_46,1010534
cluster_557,reuse,39,groupB,si conto dell affetto provato per Adriana,1010535___14_49,1010535
cluster_558,reuse,64,groupB,i toccava ora a pregare il mio ladro che mi facesse da testimoni,1010538___1_49,1010538
cluster_559,reuse,94,groupB,inerva la vecchia cagnetta co i suoi sforzi rochi abbajamenti non lasciava fare i convenevol,1010539___1_70,1010539
cluster_559,reuse,94,groupB,inerva la vecchia cagnetta co i suoi sforzi rochi abbajamenti non lasciava fare i convenevol,1010540___1_70,1010540
cluster_563,reuse,68,groupB,gli ebbe l arte di non farci mancare mai nulla finchè fosse mia madr,1010551___1_50,1010551
cluster_569,reuse,24,groupO1, viviamo più nella nostra,1010561___16_37,1010561
cluster_572,reuse,45,groupO1,arentela che fui costretto a contrarre con lu,1010562___1_36,1010562
cluster_573,reuse,23,groupO1,jutati chio t ajuto bas,1010563___1_19,1010563
cluster_574,reuse,25,groupO1, rendilo indimenticabil,1010567___32_52,1010567
cluster_575,reuse,20,groupO1,h ora ritornando viv,1010568___1_19,1010568
cluster_578,reuse,28,groupO1,ssassine Fischiai tra i dent,1010570___1_25,1010570
cluster_579,reuse,74,groupO1,an piano un occhio a quel povero morto per accorgersi che non ero i,1010571___18_66,1010571
cluster_579,reuse,74,groupA, andrò io domani da quel povero morto abbandonato là  senza un fiore senza un,1010996___1_59,1010996
cluster_579,reuse,74,groupA, andrò io domani da quel povero morto abbandonato là senza un fiore senza un,1010997___1_59,1010997
cluster_582,reuse,78,groupO1,i quei due anni e mesi di assenza avrei dato fantastiche notizie di lontani via,1010574___1_65,1010574
cluster_583,reuse,28,groupO1, il matrimonio E una,1010575___20_37,1010575
cluster_587,reuse,70,groupO1,o mi vidi escluso per sempre dalla vita senza possibilità di rientrarv,1010583___1_58,1010583
cluster_588,reuse,102,groupO1,o non dovevo uccider me un morto io dovevo uccidere quella folle assurda finzione che m aveva torturat,1010584___1_81,1010584
cluster_593,reuse,109,groupO1,a mia fortuna consisteva nell essermi liberato della moglie della suocera dei debiti delle afflizion,1010587___1_83,1010587
cluster_599,reuse,84,groupO1,ulla s inventa è vero che non abbia una qualche radice più o men profonda nella real,1010603___1_62,1010603
cluster_600,reuse,54,groupO1, ama veramente non ci si arrende facilmente,1010608___4_39,1010608
cluster_600,reuse,54,groupO1,e che veramente non voglia non può scambiare così facilmente,1010611___7_51,1010611
cluster_601,reuse,27,groupO1, ammutoliva con quella nott,1010610___14_36,1010610
cluster_607,reuse,31,groupB,erchè quando la Terra non girav,1010628___1_24,1010628
cluster_610,reuse,34,groupA,i era più ombra di noi due Io o le,1010630___1_25,1010630
cluster_611,reuse,104,groupA,i quanto è scritto qui egli serberà il segreto come se l avesse saputo sotto il sigillo della confession,1010631___1_77,1010631
cluster_612,reuse,39,groupA, questo sentimento della vita era come un lan,1010632___1_37,1010632
cluster_614,reuse,39,groupA, Mattia Pascal Una vol,1010959___31_49,1010959
cluster_618,reuse,40,groupA,a mia curiosità diventò più che mai viva,1010637___1_30,1010637
cluster_619,reuse,43,groupA,a io volevo vivere anche per me nel present,1010639___1_36,1010639
cluster_622,reuse,92,groupA,on avevo mai veduto così uomini e cose l aria tra essi e me s era d un tratto quasi snebbiat,1010643___1_68,1010643
cluster_625,reuse,81,groupA,e noi conosciamo che errare è dell uomo non è crudeltà sovrumana la giustizi,1010646___1_57,1010646
cluster_626,reuse,28,groupO2,bliotecario È perfetto Un occh,1010649___14_36,1010649
cluster_628,reuse,14,groupO2,a propria madr,1010658___61_74,1010658
cluster_630,reuse,35,groupO2,l nuovo Adriano Meis Nella vita ser,1010661___15_45,1010661
cluster_631,reuse,35,groupO2,ceri ad atti complessi Adriano Meis mu,1010697___40_71,1010697
cluster_631,reuse,35,groupA, Adriano Meis s uccideva Non c era al,1010718___7_34,1010718
cluster_633,reuse,26,groupA,bi dell universo destino co,1010664___16_38,1010664
cluster_636,reuse,42,groupO2,imasi non so per quanto tempo li su quella poltrona a pen,1010666___1_46,1010666
cluster_639,reuse,42,groupO2, ormai solo e più solo di com ero non avrei potuto essere su la terr,1010676___3_55,1010676
cluster_641,reuse,18,groupO2,prii le finestre i,1010672___13_29,1010672
cluster_643,reuse,68,groupO2, io con la mia arte in poco tempo fossi riuscito a fare un miracolo quello di f,1010673___1_59,1010673
cluster_643,reuse,68,groupO2, io con la mia arte in poco tempo fossi riuscito a fare un miracolo quello di,1010681___1_58,1010681
cluster_645,reuse,37,groupO2,me se avesse voluto pagarmi le lagrim,1010674___1_31,1010674
cluster_647,reuse,62,groupO2,essuno me ne seppe grado avevo tolto il meglio dello spettacol,1010677___1_51,1010677
cluster_649,reuse,31,groupO2,uff Io butto giù come vien vien,1010685___19_41,1010685
cluster_650,reuse,13,groupO2,olontariament,1010686___34_48,1010686
cluster_651,reuse,29,groupO2,strarre la logica dal caso co,1010687___46_67,1010687
cluster_652,reuse,105,groupO2, accorgevo che per quanto il mio animo si opponesse a prender qualità del colore del tempo pur ne soffriv,1010689___1_80,1010689
cluster_653,reuse,123,groupO2,isegni architettatiespedienti macchinati che durante la notte appaiono vani per poi sfumare alla luce del giorn,1010694___1_91,1010694
cluster_654,reuse,108,groupO2,ante quante volte non le guardai gli occhi per vedere se avesse pianto Ella mi sorrideva e mi carezzava con l,1010700___1_84,1010700
cluster_655,reuse,114,groupO2,ola al mondo infelice con quella rabbia in corpo che le faceva odiar la vita a cui già due volte aveva attentat,1010701___1_81,1010701
cluster_661,reuse,64,groupA,lla doveva odiarmi disprezzarmi com io mi odiavo e mi disprezzav,1010705___1_55,1010705
cluster_663,reuse,81,groupA,erchè io che avevo allora dodici anni avevo scambiato un Perugino per un Raffaell,1010707___1_63,1010707
cluster_664,reuse,17,groupA,jo era immaginari,1010710___1_16,1010710
cluster_665,reuse,92,groupA,omande supposizioni pensieri sentimenti tumultavano in me mentre il treno rombava nella nott,1010713___1_81,1010713
cluster_666,reuse,111,groupA, il disinganno diviene appunto dalla sproporzione tra l entità del fatto e il troppo pensiero che se ne son dat,1010714___1_90,1010714
cluster_670,reuse,86,groupA,l desiderio il bisogno d esser confortato in qualche modo crebbe fino all esasperazion,1010719___1_67,1010719
cluster_673,reuse,114,groupA,l limite è illusorio è relativo al poco lume nostro della nostra individualità nella realtà della natura non esist,1010721___1_93,1010721
cluster_674,reuse,79,groupA,l torto era mio o del caso che mi aveva fatto radere la barba e cangiare il nom,1010722___1_58,1010722
cluster_675,reuse,79,groupO2,a tirannia mascherata da libertà  non è di politica ch,1010786___1_40,1010786
cluster_675,reuse,79,groupO2,a tirannia mascherata da libertà non è di politica ch,1010787___1_40,1010787
cluster_677,reuse,89,groupA,a aveva un cuore quell ombra e non poteva amare aveva denari quell ombra e ciascuno potev,1010728___1_68,1010728
cluster_677,reuse,89,groupA,a aveva un cuore quell ombra e non poteva amare aveva denari quell ombra e ciascuno potev,1010729___1_68,1010729
cluster_679,reuse,72,groupA,eravigliavo io stesso di aver accolto viaggiando tante impressioni che ba,1010730___1_58,1010730
cluster_683,reuse,40,groupA,guardo e m invitò a guardar colei ch io facevo soffr,1010735___18_55,1010735
cluster_685,reuse,55,groupA,e il giuoco diventerà troppo pesante lo faremo durar po,1010736___1_45,1010736
cluster_687,reuse,49,groupA,ere Adriano Meis o non essere Adr,1010737___32_60,1010737
cluster_687,reuse,49,groupA,ere Adriano Meis o non essere Adr,1010738___31_59,1010738
cluster_687,reuse,49,groupA,dere Adriano Media condannato ad essere un vile un bugiard,1010958___8_55,1010958
cluster_690,reuse,96,groupA,ta a vedere quante sciocchezze l universo ci fa commettere di cui poi chiamiamo resp,1010739___1_64,1010739
cluster_690,reuse,96,groupA,e a vedere quante sciocchezze questo maledetto universo ci fa commetter,1010952___7_62,1010952
cluster_693,reuse,56,groupA,no la donna non bada come l uomo alla bellezza esteriore,1010740___9_53,1010740
cluster_693,reuse,56,groupA,no la donna non bada come l uomo alla bellezza esteriore,1010741___9_53,1010741
cluster_694,reuse,78,groupO2,ornale per un minuto di celebrità e tu vuoi stare nascosto ignorato da tutt,1010751___23_81,1010751
cluster_695,reuse,63,groupO2, che pareva il sogno di un becchino morfinomanesorridete anche,1010752___20_68,1010752
cluster_697,reuse,76,groupO2,offrivo e credevo com ogni altro sciagurato d aver diritto a un compens,1010756___3_57,1010756
cluster_698,reuse,21,groupO2,e avevo fatto Il mort,1010759___1_19,1010759
cluster_698,reuse,21,groupA,e avevo fatto il mort,1011000___27_45,1011000
cluster_699,reuse,18,groupO2,re il povero Pomin,1010760___26_42,1010760
cluster_701,reuse,82,groupO2,i abiti che indossiamo possono far pensare di noi le più strane cos,1010762___1_53,1010762
cluster_702,reuse,41,groupO2,si la scena del ritorno e lo smacco nel,1010763___17_46,1010763
cluster_702,reuse,41,groupA,si la scena del mio ritorn,1010975___14_35,1010975
cluster_705,reuse,15,groupO2,me una vertigin,1010766___17_30,1010766
cluster_708,reuse,18,groupO2,ello sconosciuto d,1010771___2_17,1010771
cluster_709,reuse,15,groupO2, spasso per Pis,1010773___16_29,1010773
cluster_710,reuse,113,groupO2,ccanto al cadavere di quel poveretto che non ha potuto tirarle un calcio e gridarle Ma levati di qua non ti conos,1010775___1_84,1010775
cluster_712,reuse,49,groupO2, Monsignor Boccamazza munificentissimo donatore u,1010776___1_41,1010776
cluster_713,reuse,40,groupO2,arionette automatiche di nuova invenzion,1010777___13_49,1010777
cluster_715,reuse,27,groupO2,apaveri perchè m addormenta,1010779___10_33,1010779
cluster_716,reuse,85,groupO2,n quella apparente floridezza ella lo aveva ingannato ingannato ingannato eh caro Batt,1010780___1_70,1010780
cluster_721,reuse,53,groupO2,sì senza ragione come si chiamano gli uccelli tra lor,1010782___1_39,1010782
cluster_722,reuse,38,groupO2,a vivo per la morte e morto per la vit,1010783___10_40,1010783
cluster_726,reuse,87,groupO2,a vanità umana non ricusa talvolta di farsi piedistallo anche di certa stima che offend,1010788___1_70,1010788
cluster_727,reuse,73,groupO2,e assurdità della vita non hanno bisogno di parer verosimili perchè sono ver,1010789___1_61,1010789
cluster_729,reuse,81,groupO2,gni oggetto in noi suol trasformarsi secondo le immagini che esso evoca e aggruppa,1010793___1_62,1010793
cluster_730,reuse,23,groupO2, berrettino da viaggio,1010794___3_20,1010794
cluster_730,reuse,23,groupA,l berrettino da viaggi,1010963___12_29,1010963
cluster_732,reuse,55,groupO2,i sta meglio vicini alla terra e sotto fors anche megli,1010797___1_43,1010797
cluster_733,reuse,44,groupO2,edi caro che si guadagna a chieder certi per,1010799___1_32,1010799
cluster_737,reuse,18,groupO2,roico bibliotecari,1010805___9_23,1010805
cluster_738,reuse,47,groupO2,ttia Ci azzuffiamo per un pezzettino di terra o,1010807___11_50,1010807
cluster_741,reuse,35,groupO2,nfinata immaginazione di Adriano Mei,1010813___4_36,1010813
cluster_742,reuse,102,groupO2,n barbone rossastro e ricciuto a scapito del naso piuttosto piccolo che si trovò come sperduto tra ess,1010832___1_77,1010832
cluster_743,reuse,73,groupO2,n ladro più ladro di Malagna non nascerà più sulla faccia della terr,1010833___1_51,1010833
cluster_744,reuse,59,groupO1, così il primo bacio bacio lungo e muto fu scambiato fra no,1010835___1_40,1010835
cluster_747,reuse,71,groupO1,vece quelle dell arte per parer vere hanno bisogno di essere verosimil,1010843___2_58,1010843
cluster_753,reuse,35,groupO1,n improvvisa soluzione la decisione di fi,1010850___1_36,1010850
cluster_754,reuse,55,groupO2,io lascio questo mio manoscritto quest ultima parte d,1010854___38_80,1010854
cluster_756,reuse,54,groupO2, sconcertarono peggio il cervello già di per sè balzan,1010857___20_57,1010857
cluster_756,reuse,54,groupO2, sconcertarono peggio il cervello già di per sè balzan,1010858___20_57,1010858
cluster_757,reuse,27,groupO2,oparlava e lagrimava con no,1010859___76_98,1010859
cluster_758,reuse,13,groupO2,nsopportabil,1010860___28_40,1010860
cluster_760,reuse,32,groupO2,roe non potevo più essere davver,1010862___1_28,1010862
cluster_761,reuse,85,groupO1, un tratto di fronte a una puntata formidabile ebbicome una vertigine e tremavo dal violenta,1010863___1_74,1010863
cluster_761,reuse,85,groupO1, un tratto di fronte a una puntata formidabile ebbicome una vertigine e tremavo dalÄ¾ violenta,1010864___1_75,1010864
cluster_763,reuse,38,groupO1,h un pajo d ali Come mi sentivo legger,1010865___1_29,1010865
cluster_766,reuse,63,groupO1,a Natura ha faticato migliaja di secoli per evolvere,1010870___1_43,1010870
cluster_769,reuse,39,groupO1,attia pascal dopo aver cambiato identità per tre volt,1010876___1_43,1010876
cluster_771,reuse,98,groupA,ffetto de miei discorsi sulle sensibilissime corde sentimentali della 40enne maestra di pianofort,1010878___1_82,1010878
cluster_771,reuse,98,groupA,ffetto de miei discorsi sulle sensibilissime corde sentimentali della 40enne maestra di pianofort,1010879___1_82,1010879
cluster_774,reuse,35,groupA,ngo Pallidissimo Incapace di intender,1010881___26_57,1010881
cluster_775,reuse,86,groupA,uperati gli scogli delle prime domande la barchetta della mia finzione potè is,1010882___1_62,1010882
cluster_777,reuse,86,groupO2,ella fantasi,1010896___16_28,1010896
cluster_778,reuse,48,groupA,lta la fronte Naso piccolo Occhiali azzurri chiar,1010884___50_88,1010884
cluster_782,reuse,38,groupO2,er fortuna l uomo si distrae facilment,1010890___1_33,1010890
