Cluster,Reuse,Length,Group,Blast_text,Node,ID
cluster_590,reuse,18,groupB,arionetta automati,1006544___12_30,1006544
cluster_592,reuse,55,groupB, me ne andavo non potevo più andarmene Mattia l amore t,1006545___3_47,1006545
cluster_593,reuse,49,groupB,tupido vattenevia levatidaipiedicodestoseccator,1006547___1_44,1006547
cluster_594,reuse,69,groupB,o spagnoloQuel mio spagnoletto barbuto e atticciato di Montecarloil,1006548___1_53,1006548
cluster_595,reuse,80,groupB,apiano eraAlto con un belPaio di baffi Imbroglione Arcifanfano con un grossoNaso,1006550___1_63,1006550
cluster_596,reuse,74,groupB,messo nulla dovevo guardarmi dietro e davanti come se avessi pe,1006551___11_63,1006551
cluster_598,reuse,15,groupB,i un sentimento,1006552___7_21,1006552
cluster_599,reuse,14,groupB,o spirito di Ma,1006554___11_24,1006554
cluster_602,reuse,51,groupB,ndescrivibile lo scompiglio delle singole lanternin,1006555___1_43,1006555
cluster_609,reuse,99,groupB,acietanto Asìnopuedeser IovoglioestarentreelsegnorPalearielamiagovernante carosegnorTerenzi,1006564___1_83,1006564
cluster_611,reuse,25,groupB, tutto quello che è stato t,1006570___13_32,1006570
cluster_612,reuse,23,groupB,vvertiva uno strofini,1006571___1_21,1006571
cluster_614,reuse,21,groupO2, Adriano Meis per Adr,1006576___31_49,1006576
cluster_616,reuse,24,groupO2,e conseguenze della nostr,1006577___47_68,1006577
cluster_617,reuse,22,groupB,e che la seduta spiriti,1006580___8_27,1006580
cluster_618,reuse,63,groupB,i chinai a cercar la bocca di lei e così il primo bacioil prim,1006582___1_41,1006582
cluster_618,reuse,63,groupO1,i chinai a cercar la bocca di lei e così il primo bacio lungo e muto fu sca,1006853___11_58,1006853
cluster_624,reuse,27,groupB,on c era altra via di scamp,1006599___45_65,1006599
cluster_625,reuse,45,groupB, che uomo dunque sei Un ombra di uomo E che vit,1006602___1_34,1006602
cluster_625,reuse,45,groupB, che uomo dunque sei Un ombra di uomo E che vit,1006603___1_34,1006603
cluster_626,reuse,86,groupB,utta la mia vita si spegneva ammutolita con quella nottesei morto di nuovo Tant,1006605___1_65,1006605
cluster_628,reuse,52,groupB,me avrei potuto pen,1006608___1_18,1006608
cluster_633,reuse,70,groupB,aseiopertenonpotevoesserevivo megliochetuoramisappiamort,1006613___1_55,1006613
cluster_634,reuse,72,groupB,on io Mattia Non aver paura Non sono morto mi vediToccami Sono io Robert,1006614___1_58,1006614
cluster_637,reuse,18,groupO2,ella mia prima mor,1006615___21_37,1006615
cluster_638,reuse,45,groupO2, voleva sempre vicini quasi temesse di perder,1006616___1_38,1006616
cluster_641,reuse,89,groupO2, morti non debbono più morire e io sì io sono ancora vivo per la morte e morto per la vit,1006620___1_66,1006620
cluster_642,reuse,91,groupO2,o già parlavo da un pezzo con la mano d Adriana e non pensavo ahimè non pensavo più a nulla,1006621___1_69,1006621
cluster_643,reuse,139,groupO2, inverno mi ricordava malinconicamemte la festa di Natale che fa desiderare il raccoglimento l intimità della cas,1006625___1_89,1006625
cluster_646,reuse,51,groupB,er cui non siamo noi non è possibile viver,1006630___14_46,1006630
cluster_647,reuse,18,groupB,mpressionecomedu,1006633___12_28,1006633
cluster_649,reuse,18,groupO2,ro l impressione d,1006761___29_45,1006761
cluster_650,reuse,25,groupB,l tuo matrimonio Ma non l hai ca,1006635___18_43,1006635
cluster_651,reuse,16,groupB,nnomedellavita,1006639___17_32,1006639
cluster_655,reuse,50,groupB,iccole cose momenti accidentali compaiono all improvvis,1006641___1_45,1006641
cluster_657,reuse,85,groupB,avoisietemorto IlvostrodomiciliolegaleealcimiterodiMusocco campocomunale44 fossa,1006642___1_70,1006642
cluster_658,reuse,35,groupB,l nome gli fu offerto in treno co,1006643___1_26,1006643
cluster_659,reuse,26,groupB,me un uccello senza nido o,1006644___6_26,1006644
cluster_660,reuse,17,groupB, ombra della mort,1006646___1_15,1006646
cluster_661,reuse,41,groupB,iconosciutoInStatoDiPutrefazione,1006649___1_32,1006649
cluster_661,reuse,41,groupO2,iconosciuto in istato d avanzata putrefazion,1006865___23_61,1006865
cluster_662,reuse,44,groupB,LampadinaDellaFedeCiAggiriamoNellaVita,1006650___8_44,1006650
cluster_663,reuse,36,groupB,oleva sapere com io facessi a vincer,1006651___1_29,1006651
cluster_664,reuse,87,groupO2,on ammetto che per il momentaneo piacere che prova la gola al passaggio d un boccone,1006652___1_62,1006652
cluster_666,reuse,73,groupO2,on sapendo che fare sperando di distrarmi un po da tante costernazioni portai que,1006653___1_67,1006653
cluster_667,reuse,98,groupO2,iangi Che piangi Piangi perchè son vivo Mi volevi morto Guardami sù guardami in faccia Vivo o mort,1006655___1_72,1006655
cluster_669,reuse,100,groupO2,ella calma che mi abbisognava per raccogliermi un pó a considerare ciò che avrei potuto e saputo far,1006657___1_72,1006657
cluster_673,reuse,56,groupO2,ia cercando l ombra come un ladro senza volgermi addietr,1006660___1_44,1006660
cluster_676,reuse,100,groupO2,imasi li solo in mezzo alla strada sconvolto triste come se tutto il mondo per me si fosse rott,1006664___1_77,1006664
cluster_677,reuse,102,groupO2,apiano sbuffò si passò la pezza sulla fronte sudata e allontanandosi si pose a guardare vers,1006665___1_75,1006665
cluster_678,reuse,90,groupO2,a io non avevo più paura delle sue mosse e non volli saperne lo pregai di spostarsi e di lasciarmi anda,1006666___1_82,1006666
cluster_680,reuse,72,groupO2,ceso giù in strada mi trovai di nuovo sperduto pur qui nella mia città  da s,1006667___1_56,1006667
cluster_680,reuse,72,groupO2,ceso giù in strada mi trovai di nuovo sperduto pur qui nella mia città da s,1006668___1_56,1006668
cluster_681,reuse,14,groupO2, venticinquelir,1006669___48_61,1006669
cluster_685,reuse,22,groupO2,on dubitare gli rispos,1006674___1_19,1006674
cluster_688,reuse,24,groupO2,l desiderio di vivere un,1006677___57_78,1006677
cluster_688,reuse,24,groupO2,l desiderio di libertà e vita,1006701___1_24,1006701
cluster_691,reuse,20,groupO2,a soddisfazione di ve,1006679___1_20,1006679
cluster_695,reuse,19,groupO2,na e Anselmo Palear,1006682___38_55,1006682
cluster_702,reuse,27,groupO2,attia provveda Mattia ripar,1006691___29_54,1006691
cluster_704,reuse,65,groupO2,on mi sembra il momento questo di scrivere libri nemmeno per scherz,1006695___1_53,1006695
cluster_705,reuse,61,groupO2,driano Meis è nato dalla fantasia con un pa,1006696___1_35,1006696
cluster_710,reuse,61,groupO1,i Mattia Pascal un bibliotecario in stato di avanzata putrefazion,1006949___36_89,1006949
cluster_712,reuse,14,groupO2,a sempre girat,1006705___41_53,1006705
cluster_713,reuse,84,groupO2,e s era spento nel silenzio m avesse invece squillato dentro furiosamente e intronat,1006707___1_71,1006707
cluster_715,reuse,55,groupO2,utto il sangue m affluì alla testa e gli orecchi presero a ronza,1006710___1_49,1006710
cluster_721,reuse,89,groupO2,i fece osservare che per quanto l uomo si sforzi di distruggere le illusioni della dalla natur,1006729___1_75,1006729
cluster_721,reuse,89,groupO2,i fece osservare che per quanto l uomo si sforzi di distruggere le illusioni della dalla natur,1006732___1_75,1006732
cluster_729,reuse,17,groupO2,onticurardinull,1006740___70_85,1006740
cluster_730,reuse,28,groupO2,e Terenzio Papiano alla conduzione di Chi l ha vist,1006741___8_49,1006741
cluster_731,reuse,84,groupO1,lludeva al Malagna all amministratore che ci scavava soppiatto la fossa sotto i pied,1006742___1_69,1006742
cluster_732,reuse,84,groupO1,alpa la talpa l amministratore che ci scavava soppiatto la fossa sotto i pied,1006776___15_77,1006776
cluster_733,reuse,75,groupO1,rcavo intanto un albergo qualunque dove chiudermi a vedere quanto avevo vint,1006743___1_60,1006743
cluster_735,reuse,17,groupO1, aria di campagna,1006744___1_14,1006744
cluster_737,reuse,41,groupO1,opo la mia terza ultima e definitiva mort,1006745___1_36,1006745
cluster_738,reuse,39,groupO1,o sapessi che mi chiamavo Mattia Pasca,1006751___28_58,1006751
cluster_740,reuse,60,groupO2,ortuna l uomo si distrae facilmente Qui Mattia Pascal rico,1006754___4_50,1006754
cluster_741,reuse,84,groupO2,e mie dita non vibravano più su una tastiera io facevo piangere e gridare l anima mi,1006758___1_65,1006758
cluster_748,reuse,60,groupO2,i dico che sono andato di qua e di là credendomi felice Poi mi sono accort,1006762___1_53,1006762
cluster_748,reuse,60,groupO2,i dico che sono andato di qua e di là credendomi felice Poi mi sono accort,1006763___1_53,1006763
cluster_750,reuse,17,groupO1, rovinato l umani,1006766___53_68,1006766
cluster_751,reuse,84,groupO1,on Eligio gli diceva che se vuole scrivere un libro dovrebbe farlo sul modello di quelli,1006767___1_66,1006767
cluster_753,reuse,67,groupO1,legiamo di impolverarci di ignoranza pur di custodire le illusion,1006771___46_99,1006771
cluster_755,reuse,53,groupO1,o reverendo amico don Eligio Pellegrinotto al quale do lo scritt,1006772___37_87,1006772
cluster_755,reuse,53,groupO1,o reverendo amico Don Eligio Pellegrinotto al quale io,1006928___27_70,1006928
cluster_759,reuse,21,groupO1, della famiglia per a,1006774___23_40,1006774
cluster_761,reuse,21,groupO2,ue no eh due no perba,1006779___1_17,1006779
cluster_763,reuse,74,groupO2,uo Comune in certe notti segnate nel calendario non fa accendere i lampion,1006781___16_73,1006781
cluster_764,reuse,21,groupB, lacrime rappresentano,1006783___55_75,1006783
cluster_765,reuse,80,groupO2, esempio voleva dire starmene lì di giorno stesa sul divano a guardare le im,1006791___7_67,1006791
cluster_768,reuse,19,groupO1,l fratello di M,1006793___1_14,1006793
cluster_772,reuse,58,groupO1,on bevve più vino per dare esempio di contineza alla mogli,1006798___1_46,1006798
cluster_775,reuse,90,groupO1,n conclusione si vede che capitato in mezzo a brava gente tutto il male lo avevo fatto i,1006801___1_67,1006801
cluster_776,reuse,103,groupO1,n quelle manine così gracili eppur quasi artigliate da un selvaggio istinto che incuteva ribrezzo e pie,1006802___1_77,1006802
cluster_777,reuse,105,groupO1,on t era bastato di esserti introdotto in casa mia come un ladro per insidiarmi la figliuola e rovinarmel,1006803___1_85,1006803
cluster_783,reuse,21,groupO2,e in balia della fortun,1006813___22_41,1006813
cluster_784,reuse,38,groupO1,e cinquecento lire d,1006814___15_30,1006814
cluster_784,reuse,38,groupO1,e cinquecento lire ricevute dal fratell,1006926___1_32,1006926
cluster_784,reuse,38,groupO1,e cinquecento lire poi servirono per me e furono come dirò la cagione della mia prima mort,1006963___4_72,1006963
cluster_786,reuse,28,groupO1,tretto per tutto questo temp,1006818___2_26,1006818
cluster_787,reuse,65,groupO1,a lo lasci lo lasci ripartire caro signore gli gridai a mia volt,1006819___15_62,1006819
cluster_791,reuse,102,groupO2, carezzare in lei il mio dolore il quale soltanto in lei che pur ne era la causa poteva trovar confort,1006824___1_79,1006824
cluster_792,reuse,17,groupO2,lla avrebbe potut,1006825___41_55,1006825
cluster_794,reuse,56,groupO2,nto il soffio che spegne in noi questo lanternino <Il li,1006830___33_76,1006830
cluster_796,reuse,31,groupO1,on poteva essere una nefandezza d,1006831___1_30,1006831
cluster_798,reuse,69,groupO1,petto e abiti Mattia ha l illuminazione circa il suo nuovo nome in treno Adriano Mei,1006832___16_83,1006832
cluster_799,reuse,119,groupO1, intanto la natura nella sua infinita grandezza non ha forse il più lontano sentore di noi e della nostra vana illusion,1006836___1_98,1006836
cluster_802,reuse,13,groupO1,no smarriment,1006839___62_75,1006839
cluster_804,reuse,42,groupO1, a un certo punto s accorge che la vita è tutta una bestialità e allora che,1006842___2_53,1006842
cluster_804,reuse,42,groupO1, un certo punto s accorge che la vita è una bestialità cosa significa i,1006880___1_48,1006880
cluster_805,reuse,13,groupO1,ore frantumat,1006843___9_22,1006843
cluster_806,reuse,35,groupO1,on potrei fare a meno di sorridere ma benevo,1006844___1_37,1006844
cluster_809,reuse,69,groupO1,enne ad aprirmi un vecchio su i sessanta in mutande di tela,1006848___1_48,1006848
cluster_811,reuse,110,groupO1,o mi ero tolto il pensiero più fastidioso e più affliggente che si possa avere vivendo quello della mort,1006849___1_82,1006849
cluster_813,reuse,26,groupO1,ignor Meis disse Adrian,1006850___11_31,1006850
cluster_815,reuse,38,groupO1,e di seguire il consiglio della Caporal,1006851___11_41,1006851
cluster_820,reuse,74,groupO1,olo che l occhio mi sarebbe rimasto un pochino più grosso dell altr,1006852___36_84,1006852
cluster_822,reuse,22,groupO1,dato via da quella cas,1006854___11_28,1006854
cluster_826,reuse,92,groupO1,prendo dopo quaranta giorni le finestre della mia camera io non provai alcuna gioia nel rive,1006855___1_74,1006855
cluster_828,reuse,97,groupO1,essuno meglio di Papiano sapeva che Adriano non poteva aver ritrovato il denaro che lui gli aveva rubat,1006856___1_83,1006856
cluster_832,reuse,40,groupO1,a cappa di piombo della menzogna addosso,1006858___55_87,1006858
cluster_832,reuse,40,groupO1,a cappa di piombo della menzogna addoss,1006860___47_78,1006860
cluster_838,reuse,72,groupO1,n caso della vita può essere assurdo un opera d arte se è opera d arte n,1006864___1_55,1006864
cluster_843,reuse,37,groupO1, di colui che voleva essere dichiarato,1006868___11_41,1006868
cluster_845,reuse,111,groupO1,me atto di omaggio alla sua memoria il signor Casati ha deposto sul tumulo un fragrante mazzo di fiori e un lumin,1006869___1_89,1006869
cluster_846,reuse,99,groupO1,eri sabato 28 è stato rinvenuto nella gora d un mulino un cadavere in istato d avanzata putrefazion,1006874___1_78,1006874
cluster_848,reuse,22,groupO1,ice della nostra rovin,1006875___72_91,1006875
cluster_852,reuse,45,groupO2,ni perciò i debiti sulla stìa restarono scope,1006878___29_63,1006878
cluster_854,reuse,81,groupO2,mmaginato che quella sera potesse accadermi qualcosa di simil,1006879___12_59,1006879
cluster_856,reuse,65,groupO1,driano Meis aveva avuto in quell anno la sua giovinezza spensier,1006882___1_54,1006882
cluster_857,reuse,116,groupO1,l primo contatto di quelle carnucce tenere e fredde ebbi un brivido nuovo un tremore do tenerezza ineffabile erano mi,1006883___1_91,1006883
cluster_858,reuse,33,groupO1,no mi vide retrocesse esterrefatt,1006885___10_39,1006885
cluster_867,reuse,63,groupO1,ell oggetto amiamo quel che vi mettiamo di noi l anima che esso acquista che è f,1006889___1_57,1006889
cluster_867,reuse,63,groupO2,ell oggetto insomma noi amiamo l anima che esso acquista solo per,1006917___1_51,1006917
cluster_869,reuse,28,groupO1,o vivo avrei potuto prenderm,1006890___54_79,1006890
cluster_873,reuse,47,groupO1,overe delle bestie è il soffrire senza ragionar,1006893___1_39,1006893
cluster_874,reuse,29,groupO1,ro impetuoso e prendevo tutto alla legger,1006896___1_35,1006896
cluster_876,reuse,106,groupO1,ro solo ormai e più solo di com ero non avrei potuto essere su la terra sciolto nel presente d ogni legame,1006897___1_82,1006897
cluster_880,reuse,116,groupO1,o ebbi proprio il sentimento di una forza quasi diabolica in me in quei momenti per cui domavo affascinavo la fortun,1006908___1_90,1006908
cluster_881,reuse,73,groupO1,o condannato inevitabilmente a mentire dalla mia condizione non avrei p,1006911___1_60,1006911
cluster_884,reuse,31,groupO2, ora concentriamoci signori mie,1006915___1_25,1006915
cluster_885,reuse,26,groupO2,minciavo a sentir il bisogno di u,1006924___1_26,1006924
cluster_891,reuse,39,groupO1,one della mia esistenza mi suggeriva al,1006933___22_54,1006933
cluster_893,reuse,32,groupO1,opo la morte delle figlie e della,1006937___24_51,1006937
cluster_896,reuse,74,groupO1, morte non possiamo capire la vita se non ci spieghiamo la mort,1006940___26_75,1006940
cluster_897,reuse,11,groupO1,iflettere s,1006941___45_56,1006941
cluster_899,reuse,64,groupO1,attia maledice Copernico perchè la sua scoperta ha rovinato l uomo,1006946___1_52,1006946
cluster_904,reuse,23,groupO1,irittura inverosimile l,1006952___21_43,1006952
cluster_910,reuse,20,groupO1,i ricordava più di m,1006956___15_30,1006956
cluster_913,reuse,59,groupO1,on ci sembra di cogliere un senso nelle sue voci misteriose,1006957___1_46,1006957
cluster_915,reuse,52,groupO1,on sapevo più come spartire le mie cure e la mia pen,1006958___1_40,1006958
cluster_916,reuse,104,groupO1,rmai noi tutti ci siamo a poco a poco adattati alla nuova concezione dell infinita nostra piccolezz,1006959___1_78,1006959
cluster_916,reuse,104,groupO1,rmai noi tutti ci siamo poco a poco adattati alla nuova concezione dell infinita nostra piccolezza nell unive,1006960___1_87,1006960
cluster_917,reuse,69,groupO1,ella corruzione dei costumi e devizi e della tristezza dei tempi che,1006962___16_71,1006962
cluster_922,reuse,28,groupO1,nche Pomino No ecco Pomino n,1006978___41_62,1006978
cluster_924,reuse,78,groupO1, anzi forse la sola ch io sapessi di certo era questa che mi chiamassi Mattia Pasca,1006980___15_77,1006980
cluster_925,reuse,83,groupO1,n intera notte vagai per il paese e per le campagne non so con che idee per la ment,1006983___1_62,1006983
cluster_929,reuse,44,groupO1,me già fuori della vita e dunque senza obbligh,1006993___19_52,1006993
cluster_4,reuse,44,groupO2,me fuori dalla vita e,1007460___4_22,1007460
cluster_4,reuse,44,groupO1, ma fuori dalla vit,1007848___21_37,1007848
cluster_4,reuse,44,groupO1, ma fuori dalla vit,1007849___21_37,1007849
cluster_4,reuse,44,groupO1, ma fuori dalla vit,1007850___21_37,1007850
cluster_6,reuse,44,groupB,derarmi come già fuori dalla vit,1007223___47_72,1007223
cluster_10,reuse,28,groupO1,on si lagnò mai de suoi mali,1007012___19_40,1007012
cluster_13,reuse,28,groupB,ndoli come se fossero conseguenza naturale della sua sciagur,1007431___38_86,1007431
cluster_14,reuse,78,groupO1,me se volesse stare in pace con la propria coscienza quando meno ce lo sarem,1007013___1_58,1007013
cluster_14,reuse,78,groupO1,oi come se volesse stare in pace con la propria conoscenza quando meno ce lo saremmo aspettato ci tradiv,1007197___3_82,1007197
cluster_15,reuse,18,groupO1, occhio sbalestrat,1007015___57_71,1007015
cluster_16,reuse,95,groupO1,e colpa ho io se Romilda invece di innamorarsi di Pomino s innamorò di me che pur le,1007017___1_65,1007017
cluster_16,reuse,95,groupB,e colpa ho io se Pomino eseguì con timidezza le mie prescrizioni e se Romilda s innamorì² di,1007082___1_70,1007082
cluster_16,reuse,95,groupB,e colpa ho io se Pomino eseguí con timidezza le mie prescrizioni e se Romilda s innamorò di,1007083___1_70,1007083
cluster_17,reuse,95,groupO1, innamorasse di Pomino andre,1007298___47_72,1007298
cluster_18,reuse,60,groupO1,fetti non puntare il dito agli altri perchè involontariament,1007018___23_73,1007018
cluster_22,reuse,60,groupO1,nto eppure chi se ne ciba e se li mette in corpo vive tra le nuvole,1007273___13_62,1007273
cluster_22,reuse,60,groupO1,ndo EPPURE CHI SE NE CIBA E SE LI METTE IN CORPO VIVE TRA LE NUVOL,1007283___39_87,1007283
cluster_22,reuse,60,groupA,nto eppure chi se ne ciba e se li mette in corpo vive tra le nuvol,1007531___13_61,1007531
cluster_22,reuse,60,groupB,nto eppure chi se ne ciba e se li mette in corpo vive tra le nuvol,1007711___8_56,1007711
cluster_24,reuse,19,groupO1,e ne consolai prest,1007022___1_17,1007022
cluster_25,reuse,45,groupO1,l furto avrebbe avuto ora uno scopo una scus,1007023___1_34,1007023
cluster_28,reuse,42,groupO1,a mi scivolava tra le dita la sabbia l ond,1007024___22_53,1007024
cluster_29,reuse,30,groupO1,attia OPPRESSIONE intollerabil,1007025___22_50,1007025
cluster_31,reuse,37,groupO2,a di Marianna Dondi l ira fun,1007027___10_34,1007027
cluster_31,reuse,37,groupB, Marianna Dondi vedova Pescator,1007246___29_56,1007246
cluster_31,reuse,37,groupB, Marianna Dondi cresceva p,1007322___14_35,1007322
cluster_35,reuse,64,groupO1,à stato scritto non avevo alcuna speranza solo cinquecento lire,1007030___23_72,1007030
cluster_37,reuse,31,groupO1,ro già stanco di stare alla bad,1007034___1_23,1007034
cluster_44,reuse,58,groupO1, vedova sconsolata dalle gioie abbandonata dinanzi la spogli,1007038___6_54,1007038
cluster_46,reuse,58,groupO2,o morto non avevo più debiti non avevo più moglie non avevo più suocera nessuno Che ce,1007166___2_65,1007166
cluster_46,reuse,58,groupO1,o morto non avevo più debiti non avevo più moglie non avevo più suocera nessuno libero libero libero,1007270___2_77,1007270
cluster_46,reuse,58,groupB,ro morto morto non avevo più debiti nè moglie nè suocera nessuno Libero Libero Liber,1007318___1_63,1007318
cluster_46,reuse,58,groupB,ro morto morto non avevo più debiti nè moglie nè suocera nessuno Libero Libero Liber,1007320___1_63,1007320
cluster_47,reuse,32,groupO1,i sentita Ebro della mia liber,1007045___38_62,1007045
cluster_48,reuse,55,groupO2,i infelici facilmente diventano superstiziosi riponendo nella sup,1007046___1_58,1007046
cluster_48,reuse,55,groupO2,i infelici diventano superstiziosi deridendo gli al,1007057___1_45,1007057
cluster_48,reuse,55,groupO2,i infelici facilmente diventano superstiziosi riponendo nella sup,1007058___1_58,1007058
cluster_53,reuse,52,groupO2, nostra inutilità a valutarci niente nell Univers,1007049___41_82,1007049
cluster_53,reuse,52,groupO2, nostra inutilità a valutarci niente nell Univers,1007060___41_82,1007060
cluster_58,reuse,93,groupO1,nche le cose più strane possono essere vere nessuna fantasia arriva a concepire certe folli,1007054___1_73,1007054
cluster_61,reuse,53,groupO2,e un oggetto ci provoca non si trovano nell oggetto ste,1007062___11_51,1007062
cluster_61,reuse,53,groupO2,e un oggetto ci procura non si trova nell oggetto per,1007445___15_53,1007445
cluster_62,reuse,50,groupO2, inverno m ispirava pensieri malinconici,1007063___1_35,1007063
cluster_62,reuse,50,groupO1,sco non a caso ispirava in lui delle riflessioni malinconich,1007571___29_77,1007571
cluster_64,reuse,17,groupO2,pettatore estrane,1007064___25_42,1007064
cluster_65,reuse,17,groupB,a vita osservata da spettatore es,1007101___1_30,1007101
cluster_66,reuse,80,groupO2,l mio animo per quanto si opponesse alla qualità del colore del tempo pur ne soffriv,1007065___11_77,1007065
cluster_66,reuse,80,groupO1,l mio animo si opponesse a prender qualità dal colore del tempo pur ne soffriv,1007517___1_63,1007517
cluster_68,reuse,80,groupO2,i sentivo sperduto sciolto dalla vita in attesa di vede,1007069___1_47,1007069
cluster_68,reuse,80,groupB,i sentivo paurosamente sciolto dalla vita in attesa di vi,1007088___1_49,1007088
cluster_68,reuse,80,groupO1,i sentivo paurosamente sciolto dalla vita superstite di me stesso in attesa di vivere oltre la morte T,1007500___1_86,1007500
cluster_68,reuse,80,groupO1,i sentivo paurosamente sciolto dalla vita superstite di me stesso sperduto in attesa di vivere oltre la morte To,1007501___1_95,1007501
cluster_71,reuse,66,groupO2,n è più tempo di scriver libri neanche per scherzo Come sempre devo ripet,1007070___2_56,1007070
cluster_71,reuse,66,groupO2,n è più tempo di scriver libri nemmeno per scherzo Come sempre devo ripet,1007071___2_57,1007071
cluster_72,reuse,53,groupO2, nostra piccolezza a valutarci niente nell Univ,1007072___33_71,1007072
cluster_72,reuse,53,groupO1, nostra piccolezza a considerarci anzi men che n,1007268___51_87,1007268
cluster_74,reuse,46,groupO2,siamo comprendere la vita se in qualche modo n,1007073___16_52,1007073
cluster_76,reuse,48,groupO2,utti noi lottiamo ogni giorno a finchè i nostri sentiment,1007074___1_46,1007074
cluster_78,reuse,36,groupO2,ella vita non hanno bisogno di parer,1007075___11_40,1007075
cluster_79,reuse,36,groupO2, Le assurdità della vita non hanno bisogno di parer verosimili perchè sono ver,1007846___10_71,1007846
cluster_82,reuse,84,groupB,a strano e diverso era già morto due volte una per errore e l altra sentiret,1007077___29_89,1007077
cluster_83,reuse,84,groupO1,o sono morto sì già due volte ma la prima per errore e la seconda sentire,1007582___16_71,1007582
cluster_83,reuse,84,groupO1,o sono morto sì già due volte ma la prima per errore la secondasenti,1007590___1_53,1007590
cluster_83,reuse,84,groupO1,o sono morto sì già due volte ma la prima per errore la seconda sent,1007591___1_52,1007591
cluster_83,reuse,84,groupB,o sono morto sì già due volte ma la prima per errore ela seconda sentire,1007808___16_71,1007808
cluster_85,reuse,31,groupB,evamo un buon amministratore,1007081___21_46,1007081
cluster_85,reuse,31,groupO1,eva al Malagna all amministratore,1007562___5_34,1007562
cluster_87,reuse,54,groupB,cchi di uno stano color verde cupi intensi ombreggiat,1007084___1_40,1007084
cluster_87,reuse,54,groupO2,cchi d uno strano color verde cupi intensi notturni t,1007477___1_42,1007477
cluster_87,reuse,54,groupO2,cchi d uno strano color verde cupi intensi notturni t,1007478___1_42,1007478
cluster_88,reuse,24,groupB,o Una croce non se ne par,1007087___11_29,1007087
cluster_90,reuse,24,groupO1, non se ne parli p,1007247___48_62,1007247
cluster_96,reuse,24,groupO1,fini di questa mia liber,1007537___56_75,1007537
cluster_96,reuse,24,groupO1,fini di questa mia liber,1007868___57_76,1007868
cluster_96,reuse,24,groupO1,fini di questa mia liber,1007869___57_76,1007869
cluster_96,reuse,24,groupO1,fini di questa mia liber,1007922___56_75,1007922
cluster_97,reuse,14,groupB,esta mia liber,1007092___16_28,1007092
cluster_97,reuse,14,groupB,esta mia liber,1007099___16_28,1007099
cluster_99,reuse,20,groupO1, frastuono della citt,1007094___4_22,1007094
cluster_100,reuse,20,groupO1,lendo con la fantasi,1007095___43_60,1007095
cluster_103,reuse,49,groupO1,o sarei il defunto marito della signora Pascal e vengo l,1007096___1_45,1007096
